01:30:13.883856 ARP, Ethernet (len 6), IPv4 (len 4), Request who-has _gateway tell 169.254.234.94, length 46
01:30:14.088641 ARP, Ethernet (len 6), IPv4 (len 4), Request who-has _gateway tell 169.254.234.94, length 46
01:30:14.268923 STP 802.1d, Config, Flags [none], bridge-id 8000.00:0f:cd:fe:e2:c1.8013, length 35
	message-age 2.00s, max-age 20.00s, hello-time 2.00s, forwarding-delay 15.00s
	root-id 8000.00:0f:cd:c1:77:41, root-pathcost 20
01:30:14.433139 IP (tos 0x0, ttl 64, id 12571, offset 0, flags [DF], proto TCP (6), length 299)
    fedora.60018 > ec2-23-22-89-125.compute-1.amazonaws.com.https: Flags [P.], cksum 0x813d (correct), seq 1929156418:1929156665, ack 1992884361, win 8171, options [nop,nop,TS val 2026307472 ecr 1614718563], length 247
01:30:14.438456 00:ff:ff:cc:11:10 (oui Unknown) > Broadcast, ethertype Unknown (0xfffa), length 95: 
	0x0000:  736f 6672 6565 4142 595a 0100 0000 0000  sofreeABYZ......
	0x0010:  0000 0000 0000 0000 0000 0000 0000 0000  ................
	0x0020:  0000 0000 0000 0000 0000 0000 0000 0000  ................
	0x0030:  0000 0000 0000 0000 0000 0000 0000 0000  ................
	0x0040:  0000 0000 0000 0000 0000 0000 0000 0000  ................
	0x0050:  00                                       .
01:30:14.677972 IP (tos 0x0, ttl 245, id 31193, offset 0, flags [DF], proto TCP (6), length 448)
    ec2-23-22-89-125.compute-1.amazonaws.com.https > fedora.60018: Flags [P.], cksum 0xf0d6 (correct), seq 1:397, ack 247, win 256, options [nop,nop,TS val 1614719819 ecr 2026307472], length 396
01:30:14.677983 IP (tos 0x0, ttl 245, id 31194, offset 0, flags [DF], proto TCP (6), length 90)
    ec2-23-22-89-125.compute-1.amazonaws.com.https > fedora.60018: Flags [P.], cksum 0xc416 (correct), seq 397:435, ack 247, win 256, options [nop,nop,TS val 1614719819 ecr 2026307472], length 38
01:30:14.678696 IP (tos 0x0, ttl 64, id 12572, offset 0, flags [DF], proto TCP (6), length 52)
    fedora.60018 > ec2-23-22-89-125.compute-1.amazonaws.com.https: Flags [.], cksum 0x3a78 (correct), ack 435, win 8171, options [nop,nop,TS val 2026307718 ecr 1614719819], length 0
01:30:14.947531 IP6 (flowlabel 0xcf14f, hlim 255, next-header UDP (17) payload length: 53) fedora.mdns > ff02::fb.mdns: [udp sum ok] 0 PTR (QM)? 94.234.254.169.in-addr.arpa. (45)
01:30:14.947631 IP (tos 0x0, ttl 255, id 33679, offset 0, flags [DF], proto UDP (17), length 73)
    fedora.mdns > mdns.mcast.net.mdns: 0 PTR (QM)? 94.234.254.169.in-addr.arpa. (45)
01:30:15.349685 IP (tos 0x0, ttl 64, id 20442, offset 0, flags [DF], proto UDP (17), length 76)
    fedora.41310 > ntp-mumbai.gombadi.com.ntp: NTPv4, Client, length 48
	Leap indicator:  (0), Stratum 0 (unspecified), poll 6 (64s), precision 32
	Root Delay: 0.000000, Root dispersion: 0.000000, Reference-ID: (unspec)
	  Reference Timestamp:  0.000000000
	  Originator Timestamp: 0.000000000
	  Receive Timestamp:    0.000000000
	  Transmit Timestamp:   336192445.018564496 (1910-08-28T02:47:25Z)
	    Originator - Receive Timestamp:  0.000000000
	    Originator - Transmit Timestamp: 336192445.018564496 (1910-08-28T02:47:25Z)
01:30:15.355869 IP (tos 0xb8, ttl 54, id 11404, offset 0, flags [DF], proto UDP (17), length 76)
    ntp-mumbai.gombadi.com.ntp > fedora.41310: NTPv4, Server, length 48
	Leap indicator:  (0), Stratum 2 (secondary reference), poll 6 (64s), precision -25
	Root Delay: 0.022994, Root dispersion: 0.002624, Reference-ID: 0x0e8b3c67
	  Reference Timestamp:  3932307918.596640070 (2024-08-10T19:45:18Z)
	  Originator Timestamp: 336192445.018564496 (1910-08-28T02:47:25Z)
	  Receive Timestamp:    3932308815.353542644 (2024-08-10T20:00:15Z)
	  Transmit Timestamp:   3932308815.353556965 (2024-08-10T20:00:15Z)
	    Originator - Receive Timestamp:  +3596116370.334978148
	    Originator - Transmit Timestamp: +3596116370.334992468
01:30:15.734141 IP (tos 0x0, ttl 64, id 12573, offset 0, flags [DF], proto TCP (6), length 299)
    fedora.60018 > ec2-23-22-89-125.compute-1.amazonaws.com.https: Flags [P.], cksum 0xc2c6 (correct), seq 247:494, ack 435, win 8171, options [nop,nop,TS val 2026308773 ecr 1614719819], length 247
01:30:15.844376 00:9e:1e:14:96:7d (oui Unknown) > 34:db:fd:77:e4:61 (oui Unknown), ethertype Unknown (0xa0a0), length 60: 
	0x0000:  0017 0101 0101 0101 0101 0101 0101 0101  ................
	0x0010:  0101 0101 0101 0101 0101 0101 0101 0101  ................
	0x0020:  0101 0101 0101 0101 0101 0101 0101       ..............
01:30:15.909139 IP (tos 0x80, ttl 125, id 46595, offset 0, flags [none], proto TCP (6), length 161)
    bom12s14-in-f14.1e100.net.https > fedora.44842: Flags [P.], cksum 0x7ff4 (correct), seq 251960162:251960271, ack 2068060700, win 256, options [nop,nop,TS val 2220551482 ecr 213186901], length 109
01:30:15.909155 IP (tos 0x80, ttl 125, id 46596, offset 0, flags [none], proto TCP (6), length 139)
    bom12s14-in-f14.1e100.net.https > fedora.44842: Flags [P.], cksum 0x97e9 (correct), seq 109:196, ack 1, win 256, options [nop,nop,TS val 2220551482 ecr 213186901], length 87
01:30:15.909156 IP (tos 0x80, ttl 125, id 46597, offset 0, flags [none], proto TCP (6), length 101)
    bom12s14-in-f14.1e100.net.https > fedora.44842: Flags [P.], cksum 0x8a24 (correct), seq 196:245, ack 1, win 256, options [nop,nop,TS val 2220551482 ecr 213186901], length 49
01:30:15.909159 IP (tos 0x80, ttl 125, id 46598, offset 0, flags [none], proto TCP (6), length 91)
    bom12s14-in-f14.1e100.net.https > fedora.44842: Flags [P.], cksum 0xa4b5 (correct), seq 245:284, ack 1, win 256, options [nop,nop,TS val 2220551482 ecr 213186901], length 39
01:30:15.910101 IP (tos 0x0, ttl 64, id 53276, offset 0, flags [DF], proto TCP (6), length 52)
    fedora.44842 > bom12s14-in-f14.1e100.net.https: Flags [.], cksum 0xd674 (correct), ack 284, win 8377, options [nop,nop,TS val 213191148 ecr 2220551482], length 0
01:30:15.910240 IP (tos 0x0, ttl 64, id 53277, offset 0, flags [DF], proto TCP (6), length 91)
    fedora.44842 > bom12s14-in-f14.1e100.net.https: Flags [P.], cksum 0x4771 (correct), seq 1:40, ack 284, win 8377, options [nop,nop,TS val 213191149 ecr 2220551482], length 39
01:30:15.913823 IP (tos 0x80, ttl 125, id 46599, offset 0, flags [none], proto TCP (6), length 52)
    bom12s14-in-f14.1e100.net.https > fedora.44842: Flags [.], cksum 0xf5ff (correct), ack 40, win 256, options [nop,nop,TS val 2220551488 ecr 213191149], length 0
01:30:15.920356 IP (tos 0x0, ttl 64, id 53278, offset 0, flags [DF], proto TCP (6), length 1452)
    fedora.44842 > bom12s14-in-f14.1e100.net.https: Flags [.], cksum 0x9916 (correct), seq 40:1440, ack 284, win 8377, options [nop,nop,TS val 213191159 ecr 2220551488], length 1400
01:30:15.920374 IP (tos 0x0, ttl 64, id 53279, offset 0, flags [DF], proto TCP (6), length 1452)
    fedora.44842 > bom12s14-in-f14.1e100.net.https: Flags [.], cksum 0x3ef9 (correct), seq 1440:2840, ack 284, win 8377, options [nop,nop,TS val 213191159 ecr 2220551488], length 1400
01:30:15.920376 IP (tos 0x0, ttl 64, id 53280, offset 0, flags [DF], proto TCP (6), length 1213)
    fedora.44842 > bom12s14-in-f14.1e100.net.https: Flags [P.], cksum 0xc9bc (correct), seq 2840:4001, ack 284, win 8377, options [nop,nop,TS val 213191159 ecr 2220551488], length 1161
01:30:15.924710 IP (tos 0x80, ttl 125, id 46600, offset 0, flags [none], proto TCP (6), length 52)
    bom12s14-in-f14.1e100.net.https > fedora.44842: Flags [.], cksum 0xf072 (correct), ack 1440, win 256, options [nop,nop,TS val 2220551499 ecr 213191159], length 0
01:30:15.924944 IP (tos 0x80, ttl 125, id 46601, offset 0, flags [none], proto TCP (6), length 52)
    bom12s14-in-f14.1e100.net.https > fedora.44842: Flags [.], cksum 0xeafa (correct), ack 2840, win 256, options [nop,nop,TS val 2220551499 ecr 213191159], length 0
01:30:15.924950 IP (tos 0x80, ttl 125, id 46602, offset 0, flags [none], proto TCP (6), length 52)
    bom12s14-in-f14.1e100.net.https > fedora.44842: Flags [.], cksum 0xe671 (correct), ack 4001, win 256, options [nop,nop,TS val 2220551499 ecr 213191159], length 0
01:30:15.948709 IP6 (flowlabel 0xcf14f, hlim 255, next-header UDP (17) payload length: 53) fedora.mdns > ff02::fb.mdns: [udp sum ok] 0 PTR (QM)? 94.234.254.169.in-addr.arpa. (45)
01:30:15.948813 IP (tos 0x0, ttl 255, id 33835, offset 0, flags [DF], proto UDP (17), length 73)
    fedora.mdns > mdns.mcast.net.mdns: 0 PTR (QM)? 94.234.254.169.in-addr.arpa. (45)
01:30:15.979009 IP (tos 0x0, ttl 245, id 31195, offset 0, flags [DF], proto TCP (6), length 448)
    ec2-23-22-89-125.compute-1.amazonaws.com.https > fedora.60018: Flags [P.], cksum 0x0798 (correct), seq 435:831, ack 494, win 256, options [nop,nop,TS val 1614721119 ecr 2026308773], length 396
01:30:15.979022 IP (tos 0x0, ttl 245, id 31196, offset 0, flags [DF], proto TCP (6), length 90)
    ec2-23-22-89-125.compute-1.amazonaws.com.https > fedora.60018: Flags [P.], cksum 0x6c93 (correct), seq 831:869, ack 494, win 256, options [nop,nop,TS val 1614721119 ecr 2026308773], length 38
01:30:15.979866 IP (tos 0x0, ttl 64, id 12574, offset 0, flags [DF], proto TCP (6), length 52)
    fedora.60018 > ec2-23-22-89-125.compute-1.amazonaws.com.https: Flags [.], cksum 0x2da6 (correct), ack 869, win 8171, options [nop,nop,TS val 2026309019 ecr 1614721119], length 0
01:30:16.162812 IP (tos 0x80, ttl 125, id 46603, offset 0, flags [none], proto TCP (6), length 117)
    bom12s14-in-f14.1e100.net.https > fedora.44842: Flags [P.], cksum 0x70a0 (correct), seq 284:349, ack 4001, win 256, options [nop,nop,TS val 2220551736 ecr 213191159], length 65
01:30:16.163545 IP (tos 0x80, ttl 125, id 46604, offset 0, flags [none], proto TCP (6), length 359)
    bom12s14-in-f14.1e100.net.https > fedora.44842: Flags [P.], cksum 0xb2a8 (correct), seq 349:656, ack 4001, win 256, options [nop,nop,TS val 2220551736 ecr 213191159], length 307
01:30:16.163915 IP (tos 0x0, ttl 64, id 53281, offset 0, flags [DF], proto TCP (6), length 52)
    fedora.44842 > bom12s14-in-f14.1e100.net.https: Flags [.], cksum 0xc364 (correct), ack 656, win 8377, options [nop,nop,TS val 213191402 ecr 2220551736], length 0
01:30:16.251748 STP 802.1d, Config, Flags [none], bridge-id 8000.00:0f:cd:fe:e2:c1.8013, length 35
	message-age 2.00s, max-age 20.00s, hello-time 2.00s, forwarding-delay 15.00s
	root-id 8000.00:0f:cd:c1:77:41, root-pathcost 20
01:30:16.720406 IP (tos 0x0, ttl 128, id 63985, offset 0, flags [none], proto UDP (17), length 78)
    172.18.10.54.netbios-ns > 172.18.255.255.netbios-ns: UDP, length 50
01:30:16.738530 IP (tos 0x0, ttl 58, id 22689, offset 0, flags [DF], proto TCP (6), length 175)
    whatsapp-cdn-shv-01-bom2.fbcdn.net.https > fedora.50514: Flags [P.], cksum 0x7551 (correct), seq 243342494:243342617, ack 1539976145, win 256, options [nop,nop,TS val 1087595701 ecr 4135005465], length 123
01:30:16.738680 IP (tos 0x0, ttl 64, id 18928, offset 0, flags [DF], proto TCP (6), length 52)
    fedora.50514 > whatsapp-cdn-shv-01-bom2.fbcdn.net.https: Flags [.], cksum 0x1169 (correct), ack 123, win 501, options [nop,nop,TS val 4135019537 ecr 1087595701], length 0
01:30:16.743061 IP (tos 0x0, ttl 64, id 18929, offset 0, flags [DF], proto TCP (6), length 142)
    fedora.50514 > whatsapp-cdn-shv-01-bom2.fbcdn.net.https: Flags [P.], cksum 0xf832 (correct), seq 1:91, ack 123, win 501, options [nop,nop,TS val 4135019541 ecr 1087595701], length 90
01:30:16.743106 IP (tos 0x0, ttl 64, id 18930, offset 0, flags [DF], proto TCP (6), length 142)
    fedora.50514 > whatsapp-cdn-shv-01-bom2.fbcdn.net.https: Flags [P.], cksum 0x5bd4 (correct), seq 91:181, ack 123, win 501, options [nop,nop,TS val 4135019541 ecr 1087595701], length 90
01:30:16.747041 IP (tos 0x0, ttl 58, id 22690, offset 0, flags [DF], proto TCP (6), length 52)
    whatsapp-cdn-shv-01-bom2.fbcdn.net.https > fedora.50514: Flags [.], cksum 0x11f7 (correct), ack 91, win 256, options [nop,nop,TS val 1087595710 ecr 4135019541], length 0
01:30:16.747051 IP (tos 0x0, ttl 58, id 22691, offset 0, flags [DF], proto TCP (6), length 52)
    whatsapp-cdn-shv-01-bom2.fbcdn.net.https > fedora.50514: Flags [.], cksum 0x119d (correct), ack 181, win 256, options [nop,nop,TS val 1087595710 ecr 4135019541], length 0
01:30:16.907548 00:9e:1e:20:38:67 (oui Unknown) > 34:db:fd:77:e4:61 (oui Unknown), ethertype Unknown (0xa0a0), length 60: 
	0x0000:  0017 0101 0101 0101 0101 0101 0101 0101  ................
	0x0010:  0101 0101 0101 0101 0101 0101 0101 0101  ................
	0x0020:  0101 0101 0101 0101 0101 0101 0101       ..............
01:30:16.918251 IP (tos 0x0, ttl 64, id 38726, offset 0, flags [DF], proto TCP (6), length 91)
    fedora.52084 > bom07s45-in-f10.1e100.net.https: Flags [P.], cksum 0x63d9 (correct), seq 74739870:74739909, ack 3858310863, win 501, options [nop,nop,TS val 641282918 ecr 1949998849], length 39
01:30:16.922395 IP (tos 0x0, ttl 61, id 37516, offset 0, flags [none], proto TCP (6), length 52)
    bom07s45-in-f10.1e100.net.https > fedora.52084: Flags [.], cksum 0x64c5 (correct), ack 39, win 256, options [nop,nop,TS val 1950057470 ecr 641282918], length 0
01:30:16.922402 IP (tos 0x0, ttl 61, id 37517, offset 0, flags [none], proto TCP (6), length 91)
    bom07s45-in-f10.1e100.net.https > fedora.52084: Flags [P.], cksum 0x60be (correct), seq 1:40, ack 39, win 256, options [nop,nop,TS val 1950057470 ecr 641282918], length 39
01:30:16.928636 IP (tos 0x0, ttl 58, id 22692, offset 0, flags [DF], proto TCP (6), length 557)
    whatsapp-cdn-shv-01-bom2.fbcdn.net.https > fedora.50514: Flags [P.], cksum 0x1638 (correct), seq 123:628, ack 181, win 256, options [nop,nop,TS val 1087595891 ecr 4135019541], length 505
01:30:16.929167 IP (tos 0x0, ttl 58, id 22693, offset 0, flags [DF], proto TCP (6), length 595)
    whatsapp-cdn-shv-01-bom2.fbcdn.net.https > fedora.50514: Flags [P.], cksum 0x706b (correct), seq 628:1171, ack 181, win 256, options [nop,nop,TS val 1087595892 ecr 4135019541], length 543
01:30:16.929352 IP (tos 0x0, ttl 64, id 18931, offset 0, flags [DF], proto TCP (6), length 52)
    fedora.50514 > whatsapp-cdn-shv-01-bom2.fbcdn.net.https: Flags [.], cksum 0x0b20 (correct), ack 1171, win 501, options [nop,nop,TS val 4135019728 ecr 1087595891], length 0
01:30:16.933733 IP (tos 0x0, ttl 64, id 18932, offset 0, flags [DF], proto TCP (6), length 126)
    fedora.50514 > whatsapp-cdn-shv-01-bom2.fbcdn.net.https: Flags [P.], cksum 0x43b7 (correct), seq 181:255, ack 1171, win 501, options [nop,nop,TS val 4135019732 ecr 1087595891], length 74
01:30:16.937637 IP (tos 0x0, ttl 58, id 22694, offset 0, flags [DF], proto TCP (6), length 52)
    whatsapp-cdn-shv-01-bom2.fbcdn.net.https > fedora.50514: Flags [.], cksum 0x0bbd (correct), ack 255, win 256, options [nop,nop,TS val 1087595901 ecr 4135019732], length 0
01:30:16.963350 IP (tos 0x0, ttl 64, id 38727, offset 0, flags [DF], proto TCP (6), length 52)
    fedora.52084 > bom07s45-in-f10.1e100.net.https: Flags [.], cksum 0x637c (correct), ack 40, win 501, options [nop,nop,TS val 641282963 ecr 1950057470], length 0
01:30:16.988990 IP (tos 0x0, ttl 64, id 12575, offset 0, flags [DF], proto TCP (6), length 299)
    fedora.60018 > ec2-23-22-89-125.compute-1.amazonaws.com.https: Flags [P.], cksum 0x7db9 (correct), seq 494:741, ack 869, win 8171, options [nop,nop,TS val 2026310028 ecr 1614721119], length 247
01:30:17.176893 IP (tos 0x0, ttl 64, id 24830, offset 0, flags [DF], proto TCP (6), length 155)
    fedora.41664 > bom12s08-in-f3.1e100.net.https: Flags [P.], cksum 0xcd3b (correct), seq 4048283929:4048284032, ack 937917801, win 2308, options [nop,nop,TS val 1315802592 ecr 1026457811], length 103
01:30:17.180783 IP (tos 0x80, ttl 125, id 19931, offset 0, flags [none], proto TCP (6), length 52)
    bom12s08-in-f3.1e100.net.https > fedora.41664: Flags [.], cksum 0xc36b (correct), ack 103, win 256, options [nop,nop,TS val 1026480887 ecr 1315802592], length 0
01:30:17.233955 IP (tos 0x0, ttl 245, id 31197, offset 0, flags [DF], proto TCP (6), length 448)
    ec2-23-22-89-125.compute-1.amazonaws.com.https > fedora.60018: Flags [P.], cksum 0x5217 (correct), seq 869:1265, ack 741, win 256, options [nop,nop,TS val 1614722374 ecr 2026310028], length 396
01:30:17.234196 IP (tos 0x0, ttl 245, id 31198, offset 0, flags [DF], proto TCP (6), length 90)
    ec2-23-22-89-125.compute-1.amazonaws.com.https > fedora.60018: Flags [P.], cksum 0x995b (correct), seq 1265:1303, ack 741, win 256, options [nop,nop,TS val 1614722375 ecr 2026310028], length 38
01:30:17.235050 IP (tos 0x0, ttl 64, id 12576, offset 0, flags [DF], proto TCP (6), length 52)
    fedora.60018 > ec2-23-22-89-125.compute-1.amazonaws.com.https: Flags [.], cksum 0x212f (correct), ack 1303, win 8171, options [nop,nop,TS val 2026310274 ecr 1614722374], length 0
01:30:17.244398 IP (tos 0x80, ttl 125, id 19932, offset 0, flags [none], proto TCP (6), length 139)
    bom12s08-in-f3.1e100.net.https > fedora.41664: Flags [P.], cksum 0x7b91 (correct), seq 1:88, ack 103, win 256, options [nop,nop,TS val 1026480949 ecr 1315802592], length 87
01:30:17.244404 IP (tos 0x80, ttl 125, id 19933, offset 0, flags [none], proto TCP (6), length 126)
    bom12s08-in-f3.1e100.net.https > fedora.41664: Flags [P.], cksum 0x7794 (correct), seq 88:162, ack 103, win 256, options [nop,nop,TS val 1026480949 ecr 1315802592], length 74
01:30:17.244405 IP (tos 0x80, ttl 125, id 19934, offset 0, flags [none], proto TCP (6), length 83)
    bom12s08-in-f3.1e100.net.https > fedora.41664: Flags [P.], cksum 0x4e25 (correct), seq 162:193, ack 103, win 256, options [nop,nop,TS val 1026480950 ecr 1315802592], length 31
01:30:17.244406 IP (tos 0x80, ttl 125, id 19935, offset 0, flags [none], proto TCP (6), length 91)
    bom12s08-in-f3.1e100.net.https > fedora.41664: Flags [P.], cksum 0x72b3 (correct), seq 193:232, ack 103, win 256, options [nop,nop,TS val 1026480950 ecr 1315802592], length 39
01:30:17.245164 IP (tos 0x0, ttl 64, id 24831, offset 0, flags [DF], proto TCP (6), length 52)
    fedora.41664 > bom12s08-in-f3.1e100.net.https: Flags [.], cksum 0xb9fe (correct), ack 232, win 2308, options [nop,nop,TS val 1315802660 ecr 1026480949], length 0
01:30:17.245267 IP (tos 0x0, ttl 64, id 24832, offset 0, flags [DF], proto TCP (6), length 91)
    fedora.41664 > bom12s08-in-f3.1e100.net.https: Flags [P.], cksum 0xe665 (correct), seq 103:142, ack 232, win 2308, options [nop,nop,TS val 1315802661 ecr 1026480949], length 39
01:30:17.248973 IP (tos 0x80, ttl 125, id 19936, offset 0, flags [none], proto TCP (6), length 52)
    bom12s08-in-f3.1e100.net.https > fedora.41664: Flags [.], cksum 0xc1d4 (correct), ack 142, win 256, options [nop,nop,TS val 1026480955 ecr 1315802661], length 0
01:30:17.411512 IP (tos 0x0, ttl 64, id 53282, offset 0, flags [DF], proto TCP (6), length 1452)
    fedora.44842 > bom12s14-in-f14.1e100.net.https: Flags [.], cksum 0x6932 (correct), seq 4001:5401, ack 656, win 8377, options [nop,nop,TS val 213192650 ecr 2220551736], length 1400
01:30:17.411530 IP (tos 0x0, ttl 64, id 53283, offset 0, flags [DF], proto TCP (6), length 1452)
    fedora.44842 > bom12s14-in-f14.1e100.net.https: Flags [.], cksum 0x82f5 (correct), seq 5401:6801, ack 656, win 8377, options [nop,nop,TS val 213192650 ecr 2220551736], length 1400
01:30:17.411532 IP (tos 0x0, ttl 64, id 53284, offset 0, flags [DF], proto TCP (6), length 1452)
    fedora.44842 > bom12s14-in-f14.1e100.net.https: Flags [.], cksum 0x39f5 (correct), seq 6801:8201, ack 656, win 8377, options [nop,nop,TS val 213192650 ecr 2220551736], length 1400
01:30:17.411533 IP (tos 0x0, ttl 64, id 53285, offset 0, flags [DF], proto TCP (6), length 107)
    fedora.44842 > bom12s14-in-f14.1e100.net.https: Flags [P.], cksum 0x920f (correct), seq 8201:8256, ack 656, win 8377, options [nop,nop,TS val 213192650 ecr 2220551736], length 55
01:30:17.411564 IP (tos 0x0, ttl 64, id 53286, offset 0, flags [DF], proto TCP (6), length 176)
    fedora.44842 > bom12s14-in-f14.1e100.net.https: Flags [P.], cksum 0xb7b8 (correct), seq 8256:8380, ack 656, win 8377, options [nop,nop,TS val 213192650 ecr 2220551736], length 124
01:30:17.416716 IP (tos 0x80, ttl 125, id 46605, offset 0, flags [none], proto TCP (6), length 52)
    bom12s14-in-f14.1e100.net.https > fedora.44842: Flags [.], cksum 0xd3df (correct), ack 5401, win 256, options [nop,nop,TS val 2220552990 ecr 213192650], length 0
01:30:17.416722 IP (tos 0x80, ttl 125, id 46606, offset 0, flags [none], proto TCP (6), length 52)
    bom12s14-in-f14.1e100.net.https > fedora.44842: Flags [.], cksum 0xce67 (correct), ack 6801, win 256, options [nop,nop,TS val 2220552990 ecr 213192650], length 0
01:30:17.416722 IP (tos 0x80, ttl 125, id 46607, offset 0, flags [none], proto TCP (6), length 52)
    bom12s14-in-f14.1e100.net.https > fedora.44842: Flags [.], cksum 0xc8ef (correct), ack 8201, win 256, options [nop,nop,TS val 2220552990 ecr 213192650], length 0
01:30:17.416723 IP (tos 0x80, ttl 125, id 46608, offset 0, flags [none], proto TCP (6), length 52)
    bom12s14-in-f14.1e100.net.https > fedora.44842: Flags [.], cksum 0xc8b8 (correct), ack 8256, win 256, options [nop,nop,TS val 2220552990 ecr 213192650], length 0
01:30:17.416723 IP (tos 0x80, ttl 125, id 46609, offset 0, flags [none], proto TCP (6), length 52)
    bom12s14-in-f14.1e100.net.https > fedora.44842: Flags [.], cksum 0xc83c (correct), ack 8380, win 256, options [nop,nop,TS val 2220552990 ecr 213192650], length 0
01:30:17.479266 IP (tos 0x0, ttl 128, id 63986, offset 0, flags [none], proto UDP (17), length 78)
    172.18.10.54.netbios-ns > 172.18.255.255.netbios-ns: UDP, length 50
01:30:17.742971 IP (tos 0x0, ttl 64, id 18933, offset 0, flags [DF], proto TCP (6), length 127)
    fedora.50514 > whatsapp-cdn-shv-01-bom2.fbcdn.net.https: Flags [P.], cksum 0x5767 (correct), seq 255:330, ack 1171, win 501, options [nop,nop,TS val 4135020541 ecr 1087595901], length 75
01:30:17.746832 IP (tos 0x0, ttl 58, id 22695, offset 0, flags [DF], proto TCP (6), length 52)
    whatsapp-cdn-shv-01-bom2.fbcdn.net.https > fedora.50514: Flags [.], cksum 0x0520 (correct), ack 330, win 256, options [nop,nop,TS val 1087596710 ecr 4135020541], length 0
01:30:17.779538 IP (tos 0x0, ttl 64, id 29666, offset 0, flags [DF], proto TCP (6), length 1500)
    fedora.48058 > 52.95.127.144.https: Flags [.], cksum 0xc4a2 (correct), seq 3634427728:3634429188, ack 2083738233, win 501, length 1460
01:30:17.779558 IP (tos 0x0, ttl 64, id 29667, offset 0, flags [DF], proto TCP (6), length 1500)
    fedora.48058 > 52.95.127.144.https: Flags [P.], cksum 0x9769 (correct), seq 1460:2920, ack 1, win 501, length 1460
01:30:17.779571 IP (tos 0x0, ttl 64, id 29668, offset 0, flags [DF], proto TCP (6), length 1482)
    fedora.48058 > 52.95.127.144.https: Flags [P.], cksum 0x126c (correct), seq 2920:4362, ack 1, win 501, length 1442
01:30:17.813351 IP (tos 0x80, ttl 125, id 46610, offset 0, flags [none], proto TCP (6), length 118)
    bom12s14-in-f14.1e100.net.https > fedora.44842: Flags [P.], cksum 0xb596 (correct), seq 656:722, ack 8380, win 256, options [nop,nop,TS val 2220553387 ecr 213192650], length 66
01:30:17.813359 IP (tos 0x80, ttl 125, id 46611, offset 0, flags [none], proto TCP (6), length 305)
    bom12s14-in-f14.1e100.net.https > fedora.44842: Flags [P.], cksum 0xc6f9 (correct), seq 722:975, ack 8380, win 256, options [nop,nop,TS val 2220553387 ecr 213192650], length 253
01:30:17.813889 IP (tos 0x0, ttl 64, id 53287, offset 0, flags [DF], proto TCP (6), length 52)
    fedora.44842 > bom12s14-in-f14.1e100.net.https: Flags [.], cksum 0xa425 (correct), ack 975, win 8377, options [nop,nop,TS val 213193052 ecr 2220553387], length 0
01:30:17.814348 IP (tos 0x80, ttl 125, id 46612, offset 0, flags [none], proto TCP (6), length 203)
    bom12s14-in-f14.1e100.net.https > fedora.44842: Flags [P.], cksum 0x3b0f (correct), seq 975:1126, ack 8380, win 256, options [nop,nop,TS val 2220553388 ecr 213192650], length 151
01:30:17.814355 IP (tos 0x80, ttl 125, id 46613, offset 0, flags [none], proto TCP (6), length 91)
    bom12s14-in-f14.1e100.net.https > fedora.44842: Flags [P.], cksum 0x17aa (correct), seq 1126:1165, ack 8380, win 256, options [nop,nop,TS val 2220553388 ecr 213192650], length 39
01:30:17.814569 IP (tos 0x0, ttl 64, id 53288, offset 0, flags [DF], proto TCP (6), length 52)
    fedora.44842 > bom12s14-in-f14.1e100.net.https: Flags [.], cksum 0xa365 (correct), ack 1165, win 8377, options [nop,nop,TS val 213193053 ecr 2220553388], length 0
01:30:17.814611 IP (tos 0x0, ttl 64, id 53289, offset 0, flags [DF], proto TCP (6), length 91)
    fedora.44842 > bom12s14-in-f14.1e100.net.https: Flags [P.], cksum 0x0aae (correct), seq 8380:8419, ack 1165, win 8377, options [nop,nop,TS val 213193053 ecr 2220553388], length 39
01:30:17.818077 IP (tos 0x80, ttl 125, id 46614, offset 0, flags [none], proto TCP (6), length 52)
    bom12s14-in-f14.1e100.net.https > fedora.44842: Flags [.], cksum 0xc2f3 (correct), ack 8419, win 256, options [nop,nop,TS val 2220553392 ecr 213193053], length 0
01:30:17.927547 IP (tos 0x0, ttl 233, id 33719, offset 0, flags [DF], proto TCP (6), length 40)
    52.95.127.144.https > fedora.48058: Flags [.], cksum 0xd43f (correct), ack 4362, win 1024, length 0
01:30:17.929184 IP (tos 0x0, ttl 58, id 22696, offset 0, flags [DF], proto TCP (6), length 1432)
    whatsapp-cdn-shv-01-bom2.fbcdn.net.https > fedora.50514: Flags [.], cksum 0x091e (correct), seq 1171:2551, ack 330, win 256, options [nop,nop,TS val 1087596891 ecr 4135020541], length 1380
01:30:17.929192 IP (tos 0x0, ttl 58, id 22697, offset 0, flags [DF], proto TCP (6), length 186)
    whatsapp-cdn-shv-01-bom2.fbcdn.net.https > fedora.50514: Flags [P.], cksum 0x058c (correct), seq 2551:2685, ack 330, win 256, options [nop,nop,TS val 1087596891 ecr 4135020541], length 134
01:30:17.929305 IP (tos 0x0, ttl 64, id 18934, offset 0, flags [DF], proto TCP (6), length 52)
    fedora.50514 > whatsapp-cdn-shv-01-bom2.fbcdn.net.https: Flags [.], cksum 0xfcd0 (correct), ack 2685, win 501, options [nop,nop,TS val 4135020728 ecr 1087596891], length 0
01:30:17.938796 IP (tos 0x0, ttl 233, id 33720, offset 0, flags [DF], proto TCP (6), length 655)
    52.95.127.144.https > fedora.48058: Flags [P.], cksum 0xf49a (correct), seq 1:616, ack 4362, win 1024, length 615
01:30:17.938942 IP (tos 0x0, ttl 64, id 29669, offset 0, flags [DF], proto TCP (6), length 40)
    fedora.48058 > 52.95.127.144.https: Flags [.], cksum 0xd3e3 (correct), ack 616, win 501, length 0
01:30:17.949945 IP6 (flowlabel 0xcf14f, hlim 255, next-header UDP (17) payload length: 53) fedora.mdns > ff02::fb.mdns: [udp sum ok] 0 PTR (QM)? 94.234.254.169.in-addr.arpa. (45)
01:30:17.950037 IP (tos 0x0, ttl 255, id 35569, offset 0, flags [DF], proto UDP (17), length 73)
    fedora.mdns > mdns.mcast.net.mdns: 0 PTR (QM)? 94.234.254.169.in-addr.arpa. (45)
01:30:18.118484 IP (tos 0x0, ttl 64, id 59175, offset 0, flags [DF], proto UDP (17), length 349)
    192.168.1.1.53372 > 192.168.1.255.palace-4: UDP, length 321
01:30:18.231395 STP 802.1d, Config, Flags [none], bridge-id 8000.00:0f:cd:fe:e2:c1.8013, length 35
	message-age 2.00s, max-age 20.00s, hello-time 2.00s, forwarding-delay 15.00s
	root-id 8000.00:0f:cd:c1:77:41, root-pathcost 20
01:30:18.236692 IP (tos 0x0, ttl 128, id 63987, offset 0, flags [none], proto UDP (17), length 78)
    172.18.10.54.netbios-ns > 172.18.255.255.netbios-ns: UDP, length 50
01:30:18.246082 IP (tos 0x0, ttl 64, id 12577, offset 0, flags [DF], proto TCP (6), length 299)
    fedora.60018 > ec2-23-22-89-125.compute-1.amazonaws.com.https: Flags [P.], cksum 0x3e20 (correct), seq 741:988, ack 1303, win 8171, options [nop,nop,TS val 2026311285 ecr 1614722374], length 247
01:30:18.282312 b4:3d:08:05:d3:70 (oui Unknown) > Broadcast, ethertype Unknown (0xfffa), length 60: 
	0x0000:  dead beef 0172 6561 6c74 656b 5f6c 6f6f  .....realtek_loo
	0x0010:  7062 6163 6b5f 6465 7465 6374 5f70 6163  pback_detect_pac
	0x0020:  6b65 7400 0000 0000 0000 0000 0000       ket...........
01:30:18.429215 IP (tos 0x0, ttl 64, id 44975, offset 0, flags [DF], proto TCP (6), length 52)
    fedora.36822 > 104.18.20.226.http: Flags [.], cksum 0xac0f (correct), ack 4117738129, win 501, options [nop,nop,TS val 1249582680 ecr 4084059989], length 0
01:30:18.433232 IP (tos 0x0, ttl 60, id 4094, offset 0, flags [DF], proto TCP (6), length 52)
    104.18.20.226.http > fedora.36822: Flags [.], cksum 0xfcc6 (correct), ack 1, win 8, options [nop,nop,TS val 4084070230 ecr 1249552268], length 0
01:30:18.434074 IP (tos 0x0, ttl 64, id 4628, offset 0, flags [none], proto UDP (17), length 88)
    fedora.53736 > one.one.one.one.domain: 61261+ [1au] AAAA? signaler-pa.clients6.google.com. (60)
01:30:18.438043 IP (tos 0x0, ttl 64, id 53290, offset 0, flags [DF], proto TCP (6), length 1452)
    fedora.44842 > bom12s14-in-f14.1e100.net.https: Flags [.], cksum 0x3e4d (correct), seq 8419:9819, ack 1165, win 8377, options [nop,nop,TS val 213193676 ecr 2220553392], length 1400
01:30:18.438069 IP (tos 0x0, ttl 64, id 53291, offset 0, flags [DF], proto TCP (6), length 1452)
    fedora.44842 > bom12s14-in-f14.1e100.net.https: Flags [.], cksum 0x80b8 (correct), seq 9819:11219, ack 1165, win 8377, options [nop,nop,TS val 213193676 ecr 2220553392], length 1400
01:30:18.438071 IP (tos 0x0, ttl 64, id 53292, offset 0, flags [DF], proto TCP (6), length 1195)
    fedora.44842 > bom12s14-in-f14.1e100.net.https: Flags [P.], cksum 0xaae3 (correct), seq 11219:12362, ack 1165, win 8377, options [nop,nop,TS val 213193676 ecr 2220553392], length 1143
01:30:18.438105 IP (tos 0x0, ttl 64, id 53293, offset 0, flags [DF], proto TCP (6), length 1452)
    fedora.44842 > bom12s14-in-f14.1e100.net.https: Flags [.], cksum 0xeafb (correct), seq 12362:13762, ack 1165, win 8377, options [nop,nop,TS val 213193676 ecr 2220553392], length 1400
01:30:18.438107 IP (tos 0x0, ttl 64, id 53294, offset 0, flags [DF], proto TCP (6), length 1452)
    fedora.44842 > bom12s14-in-f14.1e100.net.https: Flags [.], cksum 0x7044 (correct), seq 13762:15162, ack 1165, win 8377, options [nop,nop,TS val 213193676 ecr 2220553392], length 1400
01:30:18.438108 IP (tos 0x0, ttl 64, id 53295, offset 0, flags [DF], proto TCP (6), length 1452)
    fedora.44842 > bom12s14-in-f14.1e100.net.https: Flags [.], cksum 0xb0f4 (correct), seq 15162:16562, ack 1165, win 8377, options [nop,nop,TS val 213193676 ecr 2220553392], length 1400
01:30:18.438109 IP (tos 0x0, ttl 64, id 53296, offset 0, flags [DF], proto TCP (6), length 230)
    fedora.44842 > bom12s14-in-f14.1e100.net.https: Flags [P.], cksum 0x012b (correct), seq 16562:16740, ack 1165, win 8377, options [nop,nop,TS val 213193676 ecr 2220553392], length 178
01:30:18.438587 IP (tos 0x0, ttl 64, id 24833, offset 0, flags [DF], proto TCP (6), length 155)
    fedora.41664 > bom12s08-in-f3.1e100.net.https: Flags [P.], cksum 0xddb6 (correct), seq 142:245, ack 232, win 2308, options [nop,nop,TS val 1315803854 ecr 1026480955], length 103
01:30:18.438889 IP (tos 0x0, ttl 60, id 62809, offset 0, flags [DF], proto UDP (17), length 116)
    one.one.one.one.domain > fedora.53736: 61261 1/0/1 signaler-pa.clients6.google.com. AAAA 2404:6800:4009:805::200a (88)
01:30:18.441819 IP (tos 0x0, ttl 64, id 38832, offset 0, flags [DF], proto TCP (6), length 1452)
    fedora.55256 > bom07s27-in-f10.1e100.net.https: Flags [.], cksum 0x1f08 (correct), seq 3871938593:3871939993, ack 3163124139, win 501, options [nop,nop,TS val 2069931592 ecr 1699592260], length 1400
01:30:18.441832 IP (tos 0x0, ttl 64, id 38833, offset 0, flags [DF], proto TCP (6), length 1452)
    fedora.55256 > bom07s27-in-f10.1e100.net.https: Flags [.], cksum 0xdd79 (correct), seq 1400:2800, ack 1, win 501, options [nop,nop,TS val 2069931592 ecr 1699592260], length 1400
01:30:18.441834 IP (tos 0x0, ttl 64, id 38834, offset 0, flags [DF], proto TCP (6), length 342)
    fedora.55256 > bom07s27-in-f10.1e100.net.https: Flags [P.], cksum 0xc6a0 (correct), seq 2800:3090, ack 1, win 501, options [nop,nop,TS val 2069931592 ecr 1699592260], length 290
01:30:18.441855 IP (tos 0x0, ttl 64, id 38835, offset 0, flags [DF], proto TCP (6), length 95)
    fedora.55256 > bom07s27-in-f10.1e100.net.https: Flags [P.], cksum 0x0cb9 (correct), seq 3090:3133, ack 1, win 501, options [nop,nop,TS val 2069931592 ecr 1699592260], length 43
01:30:18.442377 IP (tos 0x80, ttl 125, id 46615, offset 0, flags [none], proto TCP (6), length 52)
    bom12s14-in-f14.1e100.net.https > fedora.44842: Flags [.], cksum 0xb89c (correct), ack 9819, win 256, options [nop,nop,TS val 2220554016 ecr 213193676], length 0
01:30:18.442385 IP (tos 0x80, ttl 125, id 46616, offset 0, flags [none], proto TCP (6), length 52)
    bom12s14-in-f14.1e100.net.https > fedora.44842: Flags [.], cksum 0xb324 (correct), ack 11219, win 256, options [nop,nop,TS val 2220554016 ecr 213193676], length 0
01:30:18.442387 IP (tos 0x80, ttl 125, id 46617, offset 0, flags [none], proto TCP (6), length 52)
    bom12s14-in-f14.1e100.net.https > fedora.44842: Flags [.], cksum 0xaead (correct), ack 12362, win 256, options [nop,nop,TS val 2220554016 ecr 213193676], length 0
01:30:18.442498 IP (tos 0x80, ttl 125, id 46618, offset 0, flags [none], proto TCP (6), length 52)
    bom12s14-in-f14.1e100.net.https > fedora.44842: Flags [.], cksum 0xa934 (correct), ack 13762, win 256, options [nop,nop,TS val 2220554017 ecr 213193676], length 0
01:30:18.442781 IP (tos 0x80, ttl 125, id 46619, offset 0, flags [none], proto TCP (6), length 52)
    bom12s14-in-f14.1e100.net.https > fedora.44842: Flags [.], cksum 0xa3bc (correct), ack 15162, win 256, options [nop,nop,TS val 2220554017 ecr 213193676], length 0
01:30:18.442794 IP (tos 0x80, ttl 125, id 46620, offset 0, flags [none], proto TCP (6), length 52)
    bom12s14-in-f14.1e100.net.https > fedora.44842: Flags [.], cksum 0x9e44 (correct), ack 16562, win 256, options [nop,nop,TS val 2220554017 ecr 213193676], length 0
01:30:18.442822 IP (tos 0x80, ttl 125, id 46621, offset 0, flags [none], proto TCP (6), length 52)
    bom12s14-in-f14.1e100.net.https > fedora.44842: Flags [.], cksum 0x9d92 (correct), ack 16740, win 256, options [nop,nop,TS val 2220554017 ecr 213193676], length 0
01:30:18.442933 IP (tos 0x80, ttl 125, id 19937, offset 0, flags [none], proto TCP (6), length 52)
    bom12s08-in-f3.1e100.net.https > fedora.41664: Flags [.], cksum 0xb81a (correct), ack 245, win 256, options [nop,nop,TS val 1026482149 ecr 1315803854], length 0
01:30:18.446508 IP (tos 0x80, ttl 125, id 63698, offset 0, flags [none], proto TCP (6), length 52)
    bom07s27-in-f10.1e100.net.https > fedora.55256: Flags [.], cksum 0x753a (correct), ack 1400, win 256, options [nop,nop,TS val 1699601044 ecr 2069931592], length 0
01:30:18.446630 IP (tos 0x80, ttl 125, id 63699, offset 0, flags [none], proto TCP (6), length 52)
    bom07s27-in-f10.1e100.net.https > fedora.55256: Flags [.], cksum 0x6fc2 (correct), ack 2800, win 256, options [nop,nop,TS val 1699601044 ecr 2069931592], length 0
01:30:18.446633 IP (tos 0x80, ttl 125, id 63700, offset 0, flags [none], proto TCP (6), length 52)
    bom07s27-in-f10.1e100.net.https > fedora.55256: Flags [.], cksum 0x6ea0 (correct), ack 3090, win 256, options [nop,nop,TS val 1699601044 ecr 2069931592], length 0
01:30:18.446670 IP (tos 0x80, ttl 125, id 63701, offset 0, flags [none], proto TCP (6), length 52)
    bom07s27-in-f10.1e100.net.https > fedora.55256: Flags [.], cksum 0x6e75 (correct), ack 3133, win 256, options [nop,nop,TS val 1699601044 ecr 2069931592], length 0
01:30:18.484029 00:9e:1e:14:96:7d (oui Unknown) > 34:db:fd:77:e4:61 (oui Unknown), ethertype Unknown (0xa0a0), length 60: 
	0x0000:  0017 0101 0101 0101 0101 0101 0101 0101  ................
	0x0010:  0101 0101 0101 0101 0101 0101 0101 0101  ................
	0x0020:  0101 0101 0101 0101 0101 0101 0101       ..............
01:30:18.490585 IP (tos 0x0, ttl 245, id 31199, offset 0, flags [DF], proto TCP (6), length 448)
    ec2-23-22-89-125.compute-1.amazonaws.com.https > fedora.60018: Flags [P.], cksum 0x69a2 (correct), seq 1303:1699, ack 988, win 256, options [nop,nop,TS val 1614723631 ecr 2026311285], length 396
01:30:18.490597 IP (tos 0x0, ttl 245, id 31200, offset 0, flags [DF], proto TCP (6), length 90)
    ec2-23-22-89-125.compute-1.amazonaws.com.https > fedora.60018: Flags [P.], cksum 0x5701 (correct), seq 1699:1737, ack 988, win 256, options [nop,nop,TS val 1614723631 ecr 2026311285], length 38
01:30:18.491548 IP (tos 0x0, ttl 64, id 12578, offset 0, flags [DF], proto TCP (6), length 52)
    fedora.60018 > ec2-23-22-89-125.compute-1.amazonaws.com.https: Flags [.], cksum 0x14b4 (correct), ack 1737, win 8171, options [nop,nop,TS val 2026311531 ecr 1614723631], length 0
01:30:18.506237 IP (tos 0x80, ttl 125, id 19938, offset 0, flags [none], proto TCP (6), length 139)
    bom12s08-in-f3.1e100.net.https > fedora.41664: Flags [P.], cksum 0xe065 (correct), seq 232:319, ack 245, win 256, options [nop,nop,TS val 1026482212 ecr 1315803854], length 87
01:30:18.506251 IP (tos 0x80, ttl 125, id 19939, offset 0, flags [none], proto TCP (6), length 126)
    bom12s08-in-f3.1e100.net.https > fedora.41664: Flags [P.], cksum 0x1e90 (correct), seq 319:393, ack 245, win 256, options [nop,nop,TS val 1026482212 ecr 1315803854], length 74
01:30:18.506505 IP (tos 0x80, ttl 125, id 19940, offset 0, flags [none], proto TCP (6), length 83)
    bom12s08-in-f3.1e100.net.https > fedora.41664: Flags [P.], cksum 0xce12 (correct), seq 393:424, ack 245, win 256, options [nop,nop,TS val 1026482212 ecr 1315803854], length 31
01:30:18.506512 IP (tos 0x80, ttl 125, id 19941, offset 0, flags [none], proto TCP (6), length 91)
    bom12s08-in-f3.1e100.net.https > fedora.41664: Flags [P.], cksum 0xbbdc (correct), seq 424:463, ack 245, win 256, options [nop,nop,TS val 1026482212 ecr 1315803854], length 39
01:30:18.507704 IP (tos 0x0, ttl 64, id 24834, offset 0, flags [DF], proto TCP (6), length 52)
    fedora.41664 > bom12s08-in-f3.1e100.net.https: Flags [.], cksum 0xaeab (correct), ack 463, win 2308, options [nop,nop,TS val 1315803923 ecr 1026482212], length 0
01:30:18.507801 IP (tos 0x0, ttl 64, id 24835, offset 0, flags [DF], proto TCP (6), length 91)
    fedora.41664 > bom12s08-in-f3.1e100.net.https: Flags [P.], cksum 0xefb6 (correct), seq 245:284, ack 463, win 2308, options [nop,nop,TS val 1315803923 ecr 1026482212], length 39
01:30:18.511832 IP (tos 0x80, ttl 125, id 19942, offset 0, flags [none], proto TCP (6), length 52)
    bom12s08-in-f3.1e100.net.https > fedora.41664: Flags [.], cksum 0xb682 (correct), ack 284, win 256, options [nop,nop,TS val 1026482218 ecr 1315803923], length 0
01:30:18.685879 IP (tos 0x80, ttl 125, id 63702, offset 0, flags [none], proto TCP (6), length 1040)
    bom07s27-in-f10.1e100.net.https > fedora.55256: Flags [P.], cksum 0x9ca5 (correct), seq 1:989, ack 3133, win 256, options [nop,nop,TS val 1699601283 ecr 2069931592], length 988
01:30:18.685894 IP (tos 0x80, ttl 125, id 63703, offset 0, flags [none], proto TCP (6), length 85)
    bom07s27-in-f10.1e100.net.https > fedora.55256: Flags [P.], cksum 0xaa64 (correct), seq 989:1022, ack 3133, win 256, options [nop,nop,TS val 1699601283 ecr 2069931592], length 33
01:30:18.686129 IP (tos 0x80, ttl 125, id 63704, offset 0, flags [none], proto TCP (6), length 83)
    bom07s27-in-f10.1e100.net.https > fedora.55256: Flags [P.], cksum 0xda3c (correct), seq 1022:1053, ack 3133, win 256, options [nop,nop,TS val 1699601284 ecr 2069931592], length 31
01:30:18.686208 IP (tos 0x80, ttl 125, id 63705, offset 0, flags [none], proto TCP (6), length 91)
    bom07s27-in-f10.1e100.net.https > fedora.55256: Flags [P.], cksum 0x35f3 (correct), seq 1053:1092, ack 3133, win 256, options [nop,nop,TS val 1699601284 ecr 2069931592], length 39
01:30:18.687971 IP (tos 0x0, ttl 64, id 38836, offset 0, flags [DF], proto TCP (6), length 52)
    fedora.55256 > bom07s27-in-f10.1e100.net.https: Flags [.], cksum 0x6758 (correct), ack 1092, win 501, options [nop,nop,TS val 2069931838 ecr 1699601283], length 0
01:30:18.688127 IP (tos 0x0, ttl 64, id 38837, offset 0, flags [DF], proto TCP (6), length 91)
